{
  "schema_version": "tour.v0",
  "scan_id": "demo-scan-0001",
  "title": "Demo property — panorama tour",
  "start_node": "living-room",
  "nodes": [
    {
      "id": "living-room",
      "room": "Living room",
      "panorama": "panoramas/living-room.jpg",
      "north_offset_deg": 0,
      "initial_yaw_deg": 0,
      "hotspots": [
        { "to": "kitchen", "label": "Kitchen", "yaw_deg": 90, "pitch_deg": -6 }
      ]
    },
    {
      "id": "kitchen",
      "room": "Kitchen",
      "panorama": "panoramas/kitchen.jpg",
      "north_offset_deg": 0,
      "initial_yaw_deg": 270,
      "hotspots": [
        { "to": "living-room", "label": "Living room", "yaw_deg": 270, "pitch_deg": -6 }
      ]
    }
  ]
}
